{"manifestType":"CanonFlowObligationManifest","obligations":[{"id":"cff:lab:required-contact","normalizedPredicateDigest":"sha256:219eb47d66f888c4ba5d793e0c64a653ac484d80505c0239833c2d6d10926d60","projection":{"derivation":{"admissionId":"cff:admission:cm2-required-contact-lab","kind":"Admitted"},"state":"Admitted"},"requiredGates":[{"id":"cff:gate:mutation-corpus","implementationDigest":"sha256:e334a8155b7fce69bfeedbc13565b024447a85a94c0efae3177f423f7bd34ec7","version":"v1"},{"id":"cff:gate:parser-certainty","implementationDigest":"sha256:5d65f040e0359a93d7113435f1fd1b1e44240c2cfebcf14b4ddadd70d71c9462","version":"v1"},{"id":"cff:gate:postgres-truth-table","implementationDigest":"sha256:dacb0445161bf1b6cbcc657588866e8cbf72ba15f006258d38885b65bbe7fbf7","version":"v1"},{"id":"cff:gate:round-trip","implementationDigest":"sha256:650c1f8a5ed3038b87c8811cdc9472cd6516fbb1c4930f457188653ead74c2a5","version":"v1"}],"sourceDigest":"sha256:8a71fd4510146dbd2bf2822eef5b7934bfef70612b3fa1ad97d69d5938c2bded"}],"policyDigest":"sha256:e60fee9fdc1e72f8d37ab5f11420221a2b653f6847fa32d2774dc66e60aeccf2","protectedDigest":"sha256:ce387a386ef75ca1ae2e6b81b8071efd13943ffdf57423d06ab4159e806b8ec0","schemaVersion":"1.0"}